<!ELEMENT Job (Description, Performance, Modifiers?, Gains, Config, Messages?)>
<!ATTLIST Job ShortName CDATA #REQUIRED>

<!ELEMENT Description (#PCDATA)>
<!ELEMENT Config ANY>

<!ELEMENT Performance (Factor|Trait|Mod)*>
<!ATTLIST Performance Modifier CDATA #IMPLIED>
<!ELEMENT Factor EMPTY>
<!ATTLIST Factor Skill CDATA #IMPLIED Stat CDATA #IMPLIED Weight CDATA #IMPLIED Min CDATA #IMPLIED Max CDATA #IMPLIED>

<!ELEMENT Gains (GainTrait|LoseTrait|Skill|Stat)*>
<!ATTLIST Gains XP CDATA #IMPLIED Skill CDATA #IMPLIED>
<!ELEMENT GainTrait (#PCDATA)>
<!ATTLIST GainTrait Trait CDATA #REQUIRED Threshold CDATA #REQUIRED Action CDATA #REQUIRED Event CDATA #IMPLIED Chance CDATA #IMPLIED MinPerformance CDATA #IMPLIED>
<!ELEMENT LoseTrait (#PCDATA)>
<!ATTLIST LoseTrait Trait CDATA #REQUIRED Threshold CDATA #REQUIRED Action CDATA #REQUIRED Event CDATA #IMPLIED Chance CDATA #IMPLIED MinPerformance CDATA #IMPLIED>
<!ELEMENT Skill (EMPTY)>
<!ATTLIST Skill Name CDATA #REQUIRED Weight CDATA Min CDATA Max CDATA>
<!ELEMENT Stat (EMPTY)>
<!ATTLIST Stat Name CDATA #REQUIRED Weight CDATA Min CDATA Max CDATA>

<!ELEMENT Messages (Message|Include)*)>
<!ELEMENT Message ((Text|Group)+)>
<!ATTLIST Message Name CDATA #REQUIRED>
<!ELEMENT Text (#PCDATA)>
<!ATTLIST Text Condition CDATA #IMPLIED Priority CDATA #IMPLIED Chance CDATA #IMPLIED Updates CDATA #IMPLIED>
<!ELEMENT Group ((Text|Group)+)>
<!ATTLIST Group Condition CDATA #IMPLIED Priority CDATA #IMPLIED Chance CDATA #IMPLIED Updates CDATA #IMPLIED>

<!ELEMENT Modifiers (Modifier)*>
<!ELEMENT Modifier (Trait)*>
<!ATTLIST Modifier Name CDATA #REQUIRED>
<!ELEMENT Trait (EMPTY)*>
<!ATTLIST Trait Name CDATA #REQUIRED Value CDATA #REQUIRED>

<!ELEMENT Mod (#PCDATA)>
<!ATTLIST Mod Weight CDATA #IMPLIED>

<!ELEMENT Include (#PCDATA)>