<!DOCTYPE Job SYSTEM "job.dtd">
<Job ShortName="FHnd">
    <Description>
        She will maintain the farm.
    </Description>

    <Performance>
        <Factor Skill="Service" Weight="3"/>
        <Factor Stat="Morality" Weight="1"/>
        <Factor Stat="Obedience" Weight="1"/>
        <Factor Stat="Agility" Weight="1"/>

        <Mod>work.cleaning</Mod>
    </Performance>

    <Messages>
        <Message Name="work">
            <Text>${name} worked cleaning and repairing the farm.</Text>
        </Message>
        <Message Name="refuse">
            <Text>${name} refused to work on the farm during the ${shift} shift.</Text>
        </Message>
        <Message Name="shift.bad">
            <Text>She spilled a bucket of something unpleasant all over herself.</Text>
            <Text>She did not like working on the farm today.</Text>
            <Text>She stepped in something unpleasant.</Text>
        </Message>
        <Message Name="shift.good">
            <Text>She cleaned the building while humming a pleasant tune.</Text>
            <Text>She had a great time working today.</Text>
        </Message>
        <Message Name="shift.neutral">
            <Text>The shift passed uneventfully.</Text>
        </Message>
    </Messages>
</Job>
