<!DOCTYPE Job SYSTEM "job.dtd">
<Job ShortName="FFac">
    <Description>
        She will be used in gag and face-fuck scenes.
    </Description>

    <Performance>
        <Factor Stat="Beauty" Weight="2"/>
        <Factor Stat="Charisma" Weight="1"/>
        <Factor Skill="OralSex" Weight="1"/>
        <Factor Skill="Performance" Weight="2"/>

        <Mod>work.pornstar</Mod>

        <!-- Good -->
        <Trait Name="Deep Throat" Value="80"/> <!-- better ability -->
        <Trait Name="Mind Fucked" Value="60"/> <!-- eager to please -->
        <Trait Name="No Gag Reflex" Value="50"/>
        <Trait Name="Masochist" Value="50"/>
        <Trait Name="Cum Addict" Value="40"/>
        <Trait Name="No Teeth" Value="25"/>    <!-- Lower resistance -->
        <Trait Name="Missing Teeth" Value="25"/>
        <Trait Name="Good Kisser" Value="20"/>
        <Trait Name="Dick-Sucking Lips" Value="20"/>
        <Trait Name="Demon Possessed" Value="20"/> <!-- Wild -->
        <Trait Name="Nimble Tongue" Value="10"/>
        <Trait Name="Pierced Tongue" Value="15"/>
        <Trait Name="Exotic" Value="10"/>
        <Trait Name="Whore" Value="20"/>   <!-- Knows how to work it -->
        <Trait Name="Nymphomaniac" Value="25"/>    <!-- had lots of practice -->
        <Trait Name="Slut" Value="15"/>    <!-- had practice -->
        <Trait Name="Sexy Air" Value="10"/>
        <Trait Name="Open Minded" Value="10"/>
        <Trait Name="Natural Pheromones" Value="5"/>

        <!-- Bad -->
        <Trait Name="Strong Gag Reflex" Value="-20"/>
        <Trait Name="Gag Reflex" Value="-20"/>
        <Trait Name="Clumsy" Value="-25"/>
        <Trait Name="Nervous" Value="-15"/>
    </Performance>

    <Gains XP="10" Skill="3">
        <Skill Name="Performance" Weight="2" Max="66"/>
        <Skill Name="OralSex" Weight="1" Max="75"/>
        <Stat Name="Constitution" Weight="1" Max="33"/>

        <GainTrait Trait="Mind Fucked" Threshold="90" Action="PORNSTAR" Event="2">
            She has been abused so much she is now completely Mind Fucked.
        </GainTrait>
        <GainTrait Trait="Masochist" Threshold="65" Action="SEX">
            ${name} has turned into a Masochist from filming so many BDSM scenes.
        </GainTrait>
        <GainTrait Trait="Porn Star" Threshold="80" Action="PORNSTAR" MinPerformance="200">
            She has performed in enough sex scenes that she has become a well known Porn Star.
        </GainTrait>
        <GainTrait Trait="Iron Will" Threshold="80" Action="SEX" Chance="5">
            Somewhere between having a dick in her throat, balls slapping her eyes and a camera watching her retch,
            ${name} has lost her iron will.
        </GainTrait>
    </Gains>

    <Config PrimaryAction="PORNSTAR" SecondaryAction="SEX" MinimumHealth="25" CanBeForced="1">
        <LustInfluence Amount="15" SkillMin="50" BaseValue="30" Skill="OralSex" />
    </Config>

    <Messages>
        <Message Name="work">
            <Text>${name} was filmed in facefucking scenes.</Text>
            <Text Condition="Mind Fucked">
                Mind fucked ${name} was pleased to be paraded naked in public and tortured and degraded. It is natural.
            </Text>
            <Text Condition="Masochist">
                Masochist ${name} was pleased to be tortured, used and degraded. It is her place.
            </Text>
        </Message>
        <Message Name="crew.refuse.health">
            <Text>
                The crew refused to film a throatjob scene because ${name} is not healthy enough.
                "We are NOT filming snuff".
            </Text>
        </Message>

        <Message Name="work.perfect">
            <Text>
                ${name} knelt in front of him, opened wide, and swallowed down his whole length,
                bouncing back and forward until he came
            </Text>
            <Text>
                ${name} lay on her back on the bed with her head hanging back over the edge.
                Gripping her breasts, he rammed his cock down her throat until cum exploded
            </Text>
            <Text>
                The actor sat on a chair, with ${name} knelt before him. Gripping her head,
                he pulled her onto his cock, rocking her back and forward on his cock until he came
            </Text>
            $[deep down her throat|in her mouth|deep in her stomach].
        </Message>
        <Message Name="work.great">
            <Text>${name} knelt in front of him and sucked his cock down, bouncing back and forward until he came</Text>
            <Text>${name} lay back on the bed with her head over the edge. He fucked her throat until he came</Text>
            <Text>
                The actor sat on a chair, with ${name} before him. Gripping her head,
                he pulled her onto his cock, back and forth until he came
            </Text>
            $[all over her|in her mouth|deep down her throat].
        </Message>
        <Message Name="work.good">
            <Text>${name} knelt down and let him facefuck her until he came</Text>
            <Text>${name} lay on the bed and let him fuck her throat. He carefully facefucked her until he came</Text>
            <Text>The actor pulled ${name}'s head onto his cock, rubbing his cock down her throat until he came</Text>
            $[all over her|in her mouth|deep down her throat].
        </Message>
        <Message Name="work.ok">
            <Text>${name} knelt down and get his cock down her throat. Eventually he came</Text>
            <Text>
                ${name} lay on the bed and tried to take his meat in her throat.
                He facefucked her until he finally came
            </Text>
            <Text>The actor pulled ${name}'s head onto his cock, making her gag, until he came</Text>
            $[in her face|in her mouth|over her face].
        </Message>
        <Message Name="work.bad">
            <Text>
                It was a pretty awkward scene, with the actor not getting much pleasure trying to fuck her throat.
                In the end he gave up and plunged his cock down her throat, making her throw up through her nose,
                as he came in her head.
            </Text>
        </Message>
        <Message Name="work.worst">
            <Text>
                With her continual gagging, retching and vomittig the actor couldn't get any pleasure,
                and ended up wanking over her face.
            </Text>
        </Message>

        <Message Name="disobey.free">
            <Text>${name} angrily refused to be throat-fucked on film today.</Text>
        </Message>
        <Message Name="disobey.slave.nice">
            <Text>
                ${name} angrily refused to be throat-fucked on film today.
                Though she is a slave, she was upset so you allowed her the day off.</Text>
        </Message>
        <Message Name="disobey.slave.neutral">
            <Text>
                ${name} angrily refused to be throat-fucked on film today.
                Amused, you over-ruled her, and gave owner's consent for her. She glared at you as they dragged her away.
            </Text>
        </Message>
        <Message Name="disobey.slave.evil">
            <Text>
                ${name} angrily refused to be throat-fucked on film today.
                Amused, you over-ruled her, and gave owner's consent.
                She made a hell of a fuss, but you knew just the thing to shut her up.
            </Text>
        </Message>

        <Message Name="forced-filming">
            <Text Condition="Performance>100">
                Given ${name}'s rather 'unenthusiastic' performance, the scene turned out decent enough.
            </Text>
            <Text Condition="Performance<125^stat:Spirit<60">
                ${name} is just laying there, totally unresponsive except for a few whimpers and cries.
                Not a good scene.
            </Text>
            <Text Condition="Performance<125^stat:Spirit>=60">
                Despite being tied up, ${name} managed to hurt the other actor. Needless to say, the scene
                turned out rather bad.
            </Text>
            <Text Condition="Performance<50">
                While tying her up made it possible to film this scene, the result looks so bad that maybe you should
                have just sent her to the dungeon instead.
            </Text>
        </Message>
    </Messages>
</Job>
