<!DOCTYPE Job SYSTEM "job.dtd">
<Job ShortName="FMst">
    <Description>
        She will perform in a masturbation scene.
    </Description>

    <Performance>
        <Factor Stat="Beauty" Weight="1"/>
        <Factor Stat="Charisma" Weight="2"/>
        <Factor Skill="Performance" Weight="2"/>
        <Factor Skill="Lesbian" Weight="1"/>
        <Mod>work.pornstar</Mod>
    </Performance>

    <Gains XP="10" Skill="3">
        <Skill Name="Performance" Weight="2" Min="25"/>
        <Skill Name="Lesbian" Weight="1" Max="50" Min="20"/>

        <GainTrait Trait="Porn Star" Threshold="70" Action="PORNSTAR">
            She has performed in enough sex scenes that she has become a well known Porn Star.
        </GainTrait>
        <GainTrait Trait="Fake Orgasm Expert" Threshold="50" Action="SEX">
            She has become quite the Faker.
        </GainTrait>

        <LoseTrait Trait="Chaste" Threshold="20" Action="PORNSTAR">
            She has been filmed having sex so often that she is no longer Chaste.
        </LoseTrait>
    </Gains>

    <Config PrimaryAction="PORNSTAR" SecondaryAction="SEX">
        <!-- Not sure which skill to use here -->
        <LustInfluence Amount="25" SkillMin="20" BaseValue="5" Skill="Lesbian" />
    </Config>

    <Messages>
        <Message Name="work">
            <Text>${name} worked as an actress filming Masturbation scenes.</Text>
        </Message>
        <Message Name="refuse">
            <Text>${name} refused to masturbate on film today.</Text>
        </Message>

        <Message Name="work.perfect">
            <Text>${name} embrassing the entire crew she perfectly pleased her entire body with her hands.</Text>
        </Message>
        <Message Name="work.great">
            <Text>${name} did a great job teasing the cameramage today. She worked her pussy very high for the viewer.</Text>
        </Message>
        <Message Name="work.good">
            <Text>${name} did a good job to day fingering herself. She moaned a name that couldn't be understood.</Text>
        </Message>
        <Message Name="work.ok">
            <Text>${name} did an ok job today. Sadly she was to quick to finish.</Text>
        </Message>
        <Message Name="work.bad">
            <Text>${name} did a bad scene, she was mechanical in all her actions and words.</Text>
        </Message>
        <Message Name="work.worst">
            <Text>${name} made the worst scene EVER.  She didn't even get her pussy wet. She got punished by cleaning the toilet with her own panties.</Text>
        </Message>

    </Messages>
</Job>
