<!DOCTYPE Job SYSTEM "job.dtd">
<Job ShortName="FFJ">
    <Description>
        She will perform in a foot job scene.
    </Description>

    <Performance>
        <Factor Stat="Charisma" Weight="2"/>
        <Factor Stat="Beauty" Weight="1"/>
        <Factor Skill="Performance" Weight="2"/>
        <Factor Skill="Footjob" Weight="1"/>
        <Mod>work.pornstar</Mod>
    </Performance>

    <Gains XP="15" Skill="3">
        <Skill Name="Performance" Weight="2" Max="75"/>
        <Skill Name="Footjob" Weight="1" Max="75"/>

        <GainTrait Trait="Porn Star" Threshold="70" Action="PORNSTAR">
            She has performed in enough sex scenes that she has become a well known Porn Star.
        </GainTrait>

        <LoseTrait Trait="Chaste" Threshold="20" Action="PORNSTAR">
            She has been filmed having sex so often that she is no longer Chaste.
        </LoseTrait>
    </Gains>

    <Config PrimaryAction="PORNSTAR" SecondaryAction="SEX">
        <LustInfluence Amount="10" SkillMin="20" BaseValue="5" Skill="Footjob" />
    </Config>

    <Messages>
        <Message Name="work">
            <Text>${name} worked as an actress filming foot job scenes.</Text>
        </Message>
        <Message Name="refuse">
            <Text>${name} refused to use her feet on film today.</Text>
        </Message>

        <Message Name="work.perfect">
            <Text>${name} is TRUELY a Foot Fetish Goddess! Worth every penny.</Text>
        </Message>
        <Message Name="work.great">
            <Text>${name} is a great up and cumming foot fetish actress.</Text>
        </Message>
        <Message Name="work.good">
            <Text>${name} did enjoy using her feet  today.</Text>
        </Message>
        <Message Name="work.ok">
            <Text>${name} did an OK Footjob today. Hopefully she improves in her next scene.</Text>
        </Message>
        <Message Name="work.bad">
            <Text>${name} hated giving a footjob to a creapy actor.</Text>
        </Message>
        <Message Name="work.worst">
            <Text>${name} was visually discusted using her feet. The Director yelled at her for hours.</Text>
        </Message>
    </Messages>
</Job>
