<!DOCTYPE Job SYSTEM "job.dtd">
<Job ShortName="FOrl">
    <Description>
        She will perform in an oral sex scene.
    </Description>
    <Performance>
        <Factor Stat="Charisma" Weight="2"/>
        <Factor Stat="Beauty" Weight="1"/>
        <Factor Skill="OralSex" Weight="1"/>
        <Factor Skill="Performance" Weight="2"/>

        <Mod>work.pornstar</Mod>

        <!-- Good -->
        <Trait Name="Deep Throat" Value="60"/> <!-- better ability -->
        <Trait Name="No Gag Reflex" Value="40"/>
        <Trait Name="Good Kisser" Value="20"/>
        <Trait Name="Nimble Tongue" Value="20"/>
        <Trait Name="Pierced Tongue" Value="25"/>
        <Trait Name="Dick-Sucking Lips" Value="35"/>
        <Trait Name="Exotic" Value="5"/>
        <Trait Name="Whore" Value="20"/>   <!-- Knows how to work it -->
        <Trait Name="Porn Star" Value="30"/>   <!-- Knows how to work it on film -->
        <Trait Name="No Teeth" Value="15"/>    <!-- no chance of 'accident' -->
        <Trait Name="Missing Teeth" Value="15"/>
        <Trait Name="Nymphomaniac" Value="25"/>    <!-- had lots of practice -->
        <Trait Name="Slut" Value="15"/>    <!-- had practice -->
        <Trait Name="Cum Addict" Value="30"/>  <!-- eager to please -->
        <Trait Name="Mind Fucked" Value="25"/> <!-- eager to please -->
        <Trait Name="Sexy Air" Value="10"/>
        <Trait Name="Open Minded" Value="10"/>
        <Trait Name="Natural Pheromones" Value="5"/>


        <!-- Bad -->
        <Trait Name="Strong Gag Reflex" Value="-40"/>
        <Trait Name="Gag Reflex" Value="-20"/>
        <Trait Name="Clumsy" Value="-25"/>
    </Performance>

    <Gains XP="10" Skill="3">
        <Skill Name="Performance" Weight="2" Max="75"/>
        <Skill Name="OralSex" Weight="1" Max="50"/>

        <GainTrait Trait="Porn Star" Threshold="70" Action="PORNSTAR">
            She has performed in enough sex scenes that she has become a well known Porn Star.
        </GainTrait>

        <LoseTrait Trait="Chaste" Threshold="20" Action="PORNSTAR">
            She has been filmed having sex so often that she is no longer Chaste.
        </LoseTrait>
    </Gains>

    <Config PrimaryAction="PORNSTAR" SecondaryAction="SEX">
        <LustInfluence Amount="15" SkillMin="25" BaseValue="10" Skill="OralSex" />
    </Config>

    <Messages>
        <Message Name="work">
            <Text>${name} worked as an actress filming oral scenes.</Text>
        </Message>
        <Message Name="refuse">
            <Text>${name} refused to give head on film today.</Text>
        </Message>
        <Message Name="work.perfect">
            <Text>
            The lucky guy came uncontrollably, damn near passing out in pleasure as ${name} expertly sucked him dry.
            She savoured the cum in her mouth, rolling it around her lips and tongue before finally swallowing it down.
            </Text>
        </Message>
        <Message Name="work.great">
            ${name} sucked off her man like a pro - not once breaking eye-contact - and was rewarded with
            <Text Condition="Cum Addict" Priority="1">
                a mouthful of semen. She kept her lips clamped to his cock to the last,
                thirstily swallowing down every drop of hot cum.
            </Text>
            <Text>
                a mouthful of semen. She kept her lips clamped to his cock to the last,
                thirstily swallowing down every drop of hot cum.
            </Text>
            <Text>
                an explosion of cum in her face. As she licked his penis clean,
                she rubbed cum around her skin and licked it off her fingers.
            </Text>
        </Message>
        <Message Name="work.good">
            <Text>${name} gave a fairly pleasant blowjob, and ended up glazed in hot cum.</Text>
        </Message>
        <Message Name="work.ok">
            <Text>${name} gave a passable blowjob, but in the end the actor had to finish himself off, splatting cum on her face.</Text>
        </Message>
        <Message Name="work.bad">
            <Text>
                It was a pretty awkward and uncomfortable scene,
                with the actor not getting any kind of pleasure from her clumsy, toothy attempts.
                In the end he gave up and simply wanked in her face, but even then she dodged at the last moment,
                ruining that scene too.
            </Text>
        </Message>
        <Message Name="work.worst">
            <Text>
                After the fourth time she 'snagged' the actor on her tooth, he cursed and stormed off set.
                Your goons saved the day by pinning her down wanking on her face one-by-one.
                Overall it's a terrible scene.
            </Text>
        </Message>
    </Messages>
</Job>
