<!DOCTYPE Job SYSTEM "job.dtd">
<Job ShortName="Bksm">
    <Description>
        She will make weapons and armor.
    </Description>

    <Performance>
        <Factor Skill="Crafting" Weight="2"/>
        <Factor Stat="Strength" Weight="2"/>
        <Factor Skill="Combat" Weight="1"/>
        <Factor Skill="Magic" Weight="1"/>
        <Factor Stat="Intelligence" Weight="1"/>
        <Factor Stat="Constitution" Weight=""/>
    </Performance>

    <Gains XP="10" Skill="3">
        <Skill Name="Crafting" Weight="2" />
        <Stat Name="Strength" Weight="2" />
        <Stat Name="Constitution" Weight="2" />
        <Skill Name="Combat" Weight="1" />
        <Skill Name="Magic" Weight="1" />
        <GainTrait Trait="Tough" Threshold="50" Action="MAKEITEMS">
            Working in the heat of the forge has made ${name} rather Tough.
        </GainTrait>
    </Gains>

    <Messages>
        <Message Name="work">
            <Text>${name} worked as a blacksmith at the arena.</Text>
        </Message>
        <Message Name="repair">
            <Text>She spent some of her time repairing the Arena's equipment instead of making new stuff.</Text>
        </Message>
        <Message Name="produce">
            <Text>${name} made:</Text>
        </Message>
    </Messages>
</Job>
