<!DOCTYPE Job SYSTEM "job.dtd">
<Job ShortName="ClnC">
    <Description>
        She will clean the centre.
    </Description>

    <Performance>
        <Factor Skill="Service" Weight="3"/>
        <Factor Stat="Obedience" Weight="1"/>
        <Factor Stat="Morality" Weight="1"/>
        <Factor Stat="Agility" Weight="1"/>

        <Mod>work.cleaning</Mod>
    </Performance>

    <Messages>
        <Message Name="work">
            <Text>${name} worked cleaning the Centre.</Text>
        </Message>
        <Message Name="refuse">
            <Text>${name} refused to clean the Centre.</Text>
        </Message>
        <Message Name="shift.bad">
            <Text>She spilled a bucket of something unpleasant all over herself.</Text>
            <Text>She did not like cleaning the Centre today.</Text>
        </Message>
        <Message Name="shift.good">
            <Text>She cleaned the building while humming a pleasant tune.</Text>
            <Text>She had a great time working today.</Text>
        </Message>
        <Message Name="shift.neutral">
            <Text>The shift passed uneventfully.</Text>
        </Message>

        <Message Name="event.nap">
            <Text Updates="Image='REST'">${name} finished her cleaning early, so she took nap.</Text>
        </Message>

        <Message Name="event.bath">
            <Text Updates="Image='BATH'">${name} finished her cleaning early, so took a long bath to clean herself off.</Text>
        </Message>

        <Message Name="event.play">
            <Text>${name} finished her cleaning early, so she played with the children a bit.</Text>
        </Message>
    </Messages>
</Job>
