<!DOCTYPE Job SYSTEM "job.dtd">
<Job ShortName="Mlkr">
    <Description>
        She will milk the various animals and girls you own.
    </Description>

    <Performance>
        <Factor Skill="AnimalHandling" Weight="3"/>
        <Factor Skill="Handjob" Weight="3"/>
        <Factor Stat="Intelligence" Weight="2"/>
        <Factor Skill="Farming" Weight="2" />

        <!-- good traits -->
        <Trait Name="Quick Learner" Value="5"/>
        <Trait Name="Psychic" Value="10"/>
        <Trait Name="Farmers Daughter" Value="30"/>
        <Trait Name="Country Gal" Value="10"/>

        <!-- bad traits -->
        <Trait Name="Dependant" Value="-50"/> <!-- needs others to do the job -->
        <Trait Name="Clumsy" Value="-20"/> <!-- spills food and breaks things often -->
        <Trait Name="Aggressive" Value="-20"/> <!-- gets mad easy -->
        <Trait Name="Nervous" Value="-30"/> <!-- don't like to be around people -->
        <Trait Name="Meek" Value="-20"/>

        <Trait Name="One Arm" Value="-40"/>
        <Trait Name="One Foot" Value="-40"/>
        <Trait Name="One Hand" Value="-30"/>
        <Trait Name="One Leg" Value="-60"/>
        <Trait Name="No Arms" Value="-125"/>
        <Trait Name="No Feet" Value="-60"/>
        <Trait Name="No Hands" Value="-50"/>
        <Trait Name="No Legs" Value="-100"/>
        <Trait Name="Blind" Value="-30"/>
        <Trait Name="Deaf" Value="-15"/>
        <Trait Name="Retarded" Value="-60"/>
        <Trait Name="Smoker" Value="-10"/> <!-- would need smoke breaks -->

        <Trait Name="Alcoholic" Value="-25"/>
        <Trait Name="Fairy Dust Addict" Value="-25"/>
        <Trait Name="Shroud Addict" Value="-25"/>
        <Trait Name="Viras Blood Addict" Value="-25"/>
    </Performance>

    <Gains XP="10" Skill="3">
        <Skill Name="AnimalHandling"/>
        <Skill Name="Handjob"/>
    </Gains>

    <Messages>
        <Message Name="work">
            <Text>${name} worked as a milker on the farm.</Text>
        </Message>
        <Message Name="refuse">
            <Text>${name} refused to work during the ${shift} shift.</Text>
        </Message>

        <Message Name="work.perfect">
            <Text>Her milk bucket practically fills itself as she walks down the rows of cows.</Text>
        </Message>
        <Message Name="work.great">
            <Text>Her hands moved like lightning as she gracefully milks the cows teats.</Text>
        </Message>
        <Message Name="work.good">
            <Text>She knows exactly when the cows are ready to be milked and how to best milk them.</Text>
        </Message>
        <Message Name="work.ok">
            <Text>She can milk the cows without spilling much.</Text>
        </Message>
        <Message Name="work.bad">
            <Text>She isn't very good at aiming the teats into the bucket.</Text>
        </Message>
        <Message Name="work.worst">
            <Text>She can't seem to get the hang of this.</Text>
        </Message>
    </Messages>
</Job>
