<!DOCTYPE Job SYSTEM "job.dtd">
<Job ShortName="Hcok">
    <Description>
        She will cook for your house.
    </Description>

    <Performance>
        <Factor Skill="Cooking" Weight="3"/>
        <Factor Skill="Herbalism" Weight="1"/>
        <Factor Skill="Service" Weight="1"/>
        <Factor Stat="Intelligence" Weight="1"/>

        <!-- good traits -->
        <Trait Name="Quick Learner" Value="5"/>
        <Trait Name="Psychic" Value="10"/>
        <Trait Name="Chef" Value="30"/>
        <Trait Name="Mixologist" Value="20"/>  <!-- Good with measures -->

        <!-- bad traits -->
        <Trait Name="Dependent" Value="-50"/> <!-- needs others to do the job -->
        <Trait Name="Clumsy" Value="-20"/> <!-- spills food and breaks things often -->
        <Trait Name="Aggressive" Value="-20"/> <!-- gets mad easy -->
        <Trait Name="Nervous" Value="-20"/> <!-- don't like to be around people -->
        <Trait Name="Meek" Value="-10"/>

        <Trait Name="One Arm" Value="-40"/>
        <Trait Name="One Foot" Value="-20"/>
        <Trait Name="One Hand" Value="-30"/>
        <Trait Name="One Leg" Value="-60"/>
        <Trait Name="No Arms" Value="-125"/>
        <Trait Name="No Feet" Value="-50"/>
        <Trait Name="No Hands" Value="-75"/>
        <Trait Name="No Legs" Value="-40"/>
        <Trait Name="Blind" Value="-30"/>
        <Trait Name="Deaf" Value="-15"/>
        <Trait Name="Retarded" Value="-60"/>
        <Trait Name="Smoker" Value="-10"/> <!-- would need smoke breaks -->

        <Trait Name="Alcoholic" Value="-25"/>
        <Trait Name="Fairy Dust Addict" Value="-25"/>
        <Trait Name="Shroud Addict" Value="-25"/>
        <Trait Name="Viras Blood Addict" Value="-25"/>
    </Performance>

    <Gains XP="20" Skill="3">
        <LoseTrait Trait="Clumsy" Threshold="30" Action="COOKING">
            It took her breaking hundreds of dishes, and just as many reprimands,
            but ${name} has finally stopped being so Clumsy.
        </LoseTrait>
        <Skill Name="Cooking"/>
    </Gains>

    <Config>
        <WageFunction>
            <Point Performance="245" Wages="20" />
            <Point Performance="185" Wages="15" />
            <Point Performance="145" Wages="10" />
            <Point Performance="100" Wages="5" />
            <Point Performance="70" Wages="0" />
            <Point Performance="0" Wages="-15" />
        </WageFunction>
    </Config>

    <Messages>
        <Message Name="work">
            <Text>${name} worked cooking for your House.</Text>
        </Message>
        <Message Name="refuse">
            <Text>${name} refused to cook for your House.</Text>
        </Message>

        <Message Name="work.perfect">
            <Text>She must be perfect at this.</Text>
        </Message>
        <Message Name="work.great">
            <Text>She's unbelievable at this and is always getting praised by people for her work.</Text>
        </Message>
        <Message Name="work.good">
            <Text>She's good at this job and gets praised by people often.</Text>
        </Message>
        <Message Name="work.ok">
            <Text>She made a few mistakes but overall she is okay at this.</Text>
        </Message>
        <Message Name="work.bad">
            <Text>She was nervous and made a few mistakes. She isn't that good at this.</Text>
        </Message>
        <Message Name="work.worst">
            <Text>She was nervous and constantly making mistakes. She really isn't very good at this job.</Text>
        </Message>
    </Messages>
</Job>
