<!DOCTYPE Job SYSTEM "job.dtd">
<Job ShortName="Doc">
    <Description>
        She will become a doctor. Doctors earn extra cash from treating locals. (requires at least 1 to perform surgeries)
    </Description>

    <Performance>
        <Factor Skill="Medicine" Weight="2"/>
        <Factor Stat="Intelligence" Weight="1"/>

        <!-- good traits -->
        <Trait Name="Charismatic" Value="20"/>
        <Trait Name="Sexy Air" Value="10"/>
        <Trait Name="Cool Person" Value="10"/>
        <Trait Name="Cute" Value="5"/>
        <Trait Name="Charming" Value="15"/>
        <Trait Name="Nerd" Value="30"/>
        <Trait Name="Quick Learner" Value="10"/>
        <Trait Name="Psychic" Value="20"/> <!-- Don't have to ask "Where does it hurt?" -->
        <Trait Name="Doctor" Value="50"/>
        <Trait Name="Goddess" Value="10"/> <!-- might be able to heal people easier.. they are a goddess after all -->
        <Trait Name="Optimist" Value="10"/>
        <Trait Name="Priestess" Value="10"/>

        <!-- bad traits -->
        <Trait Name="Dependant" Value="-50"/>
        <Trait Name="Clumsy" Value="-20"/>
        <Trait Name="Aggressive" Value="-20"/>
        <Trait Name="Nervous" Value="-50"/>
        <Trait Name="Retarded" Value="-100"/>
        <Trait Name="Meek" Value="-20"/>
        <Trait Name="Mind Fucked" Value="-50"/>
        <Trait Name="Pessimist" Value="-10"/>
        <Trait Name="Sadistic" Value="-20"/>
        <Trait Name="Zombie" Value="-100"/>

        <Trait Name="One Arm" Value="-40"/>
        <Trait Name="One Foot" Value="-40"/>
        <Trait Name="One Hand" Value="-30"/>
        <Trait Name="One Leg" Value="-60"/>
        <Trait Name="No Arms" Value="-150"/>
        <Trait Name="No Feet" Value="-60"/>
        <Trait Name="No Hands" Value="-90"/>
        <Trait Name="No Legs" Value="-150"/>
        <Trait Name="Blind" Value="-75"/>
        <Trait Name="Deaf" Value="-15"/>
        <Trait Name="Retarded" Value="-60"/>
        <Trait Name="Smoker" Value="-10"/> <!-- would need smoke breaks -->

        <Trait Name="Former Addict" Value="-25"/> <!-- not good idea to let former addict around all those drugs -->
        <Trait Name="Alcoholic" Value="-25"/>
        <Trait Name="Fairy Dust Addict" Value="-25"/>
        <Trait Name="Shroud Addict" Value="-25"/>
        <Trait Name="Viras Blood Addict" Value="-25"/>
    </Performance>

    <Gains XP="10" Skill="3">
        <Skill Name="Medicine" Weight="2" />
        <Stat Name="Intelligence" Weight="1" />
    </Gains>

    <Messages>
        <Message Name="work">
            <Text>${name} worked as a Doctor.</Text>
        </Message>
    </Messages>
</Job>
